### ISSUE TITLE
TLS record fragmentation, DPYProxy

### ISSUE THREAD

**Issue by wkrp** [net4people/bbs#308]
[Circumventing the GFW with TLS Record Fragmentation](https://upb-syssec.github.io/blog/2023/record-fragmentation/)
Niklas Niere (@JonSnowWhite)
https://github.com/UPB-SysSec/DPYProxy

This blog post explores an interesting idea: fragmenting TLS messages (especially Client Hello) over multiple TLS records. This is different from TCP segmentation, which has been studied in the past by, e.g., [Winter & Lindskog 2012](https://censorbib.nymity.ch/#Winter2012a) (Section 5.2, [brdgrd](https://github.com/NullHypothesis/brdgrd)), [Khattak et al. 2013](https://censorbib.nymity.ch/#Khattak2013a), and [Bock et al. 2021](https://censorbib.nymity.ch/#Bock2021c) (Section 4.1), and is implemented in tools including [GoodbyeDPI](https://github.com/ValdikSS/GoodbyeDPI#active-dpi). Rather, this research takes advantage of the fact that TLS [*messages*](https://www.rfc-editor.org/rfc/rfc5246#section-6) (e.g. Client Hello) are carried in TLS [*records*](https://www.rfc-editor.org/rfc/rfc5246#section-6.2), and that one message may be [fragmented](https://www.rfc-editor.org/rfc/rfc5246#section-6.2.1) over multiple records:

> The TLS Record Protocol is a layered protocol.  At each layer, messages may include fields for length, description, and content. The Record Protocol takes messages to be transmitted, fragments the data into manageable blocks, optionally compresses the data, applies a MAC, encrypts, and transmits the result.

The post introduces a tool, [DPYProxy](https://github.com/UPB-SysSec/DPYProxy), that fragments TLS messages over multiple records ([by parsing the user's TLS records and re-wrapping them in multiple shorter records](https://github.com/UPB-SysSec/DPYProxy/blob/8913cd6bc18c53c532cedaf0c54cd2fd366ec4ee/network/Proxy.py#L101-L132)). They [test the tool in China](https://upb-syssec.github.io/blog/2023/record-fragmentation/#proof-of-concent) and find that when a Client Hello message is fragmented at the TLS record layer, the SNI is not interpreted by the firewall and the connection doesn't get blocked. (Surprisingly, *TCP-layer* segmentation also worked in their tests—as long as the Client Hello message is broken *before* the SNI extension.)

**Comment by HectorHW** [comment]
Verified to work (for now at least) against Roskomnadzor blocking https websites in Russia. Nice find!

**Comment by JonSnowWhite** [comment]
@HectorHW Thanks for the info!

**Comment by alidxdydz** [comment]
I believe both [TCP Segmentation](https://github.com/XTLS/Xray-core/pull/2021) and [TLS Hello Fragmentation](https://github.com/XTLS/Xray-core/pull/2131) are implemented in [Xray-core](https://github.com/XTLS/Xray-core).
Although, some CDNs like Fastly are not compatible with these methods, they work fine with majority of websites in Iran using different ISPs.
Also, to my understanding @rprx and Chinese community insist that these methods do not work in China.

**Comment by klzgrad** [comment]
It is less likely for realtime systems to handle TCP or TLS reassembly due to its computation or memory cost at scale, in realtime, but this is not a fact that can be relied on in general. During a previous blockage of Cloudflare in https://github.com/net4people/bbs/issues/295 I tested various ways of TCP fragmentation of TLS Hello and was able to trigger TCP resets in all variations. I believe in general it is more likely for offline and deeper traffic analysis to perform traffic reassembly as realtime decisions are not required.

**Comment by RPRX** [comment]
@5e2t 针对河南 GFW 和广州国际出口 GFW 测试过 tlshello 分片：https://github.com/XTLS/Xray-core/issues/2426#issuecomment-1719685919

我的观点是这些分片 **可能可用，但 GFW 并不需要重组它们，目前来说，一个报文只含一部分而不是完整的 client hello 即为异常**

**Comment by JonSnowWhite** [comment]
Should Record Fragmentation not work standalone, it can hopefully be combined with TCP fragmentation. That might be something to try out for circumvention tools like XRay. Especially when the TCP and TLS Records are of different size/in different order.

**Comment by fortuna** [comment]
FYI, I tested TLS Record fragmentation with DPYProxy last month and was able to demonstrate that it bypasses SNI-based blocking in an network in Russia and one in Iran.

I also realized that leaving a single byte of the first message out of the first record was enough to bypass censorship. That suggests to me that they just give up parsing TLS. Perhaps they require the message length to be the record length -5 in their TLS detector. This may help against blocking based on TLS fingerprint because of that.

See the commands I used for testing at https://github.com/UPB-SysSec/DPYProxy/issues/2#issuecomment-1769539007

This is how the TCP fragmentation looks like on tshark:
```
Transmission Control Protocol, Src Port: 40334, Dst Port: 443, Seq: 1143, Ack: 100, Len: 23
[21 Reassembled TCP Segments (517 bytes): #28(19), #29(25), #30(25), #31(25), #32(25), #33(25), #34(25), #35(25), #36(25), #37(25), #38(25), #39(25), #40(25), #41(25), #42(25), #43(25), #44(25), #45(25), #46(25), #47(25), #48(23)]
Transport Layer Security
    TLSv1.3 Record Layer: Handshake Protocol: Client Hello
        Content Type: Handshake (22)
        Version: TLS 1.2 (0x0303)
        Length: 512
        Handshake Protocol: Client Hello
            Handshake Type: Client Hello (1)
            Length: 508
            Version: TLS 1.2 (0x0303)
```

This is how it looks with TLS record fragmentation only:
```
Transmission Control Protocol, Src Port: 58772, Dst Port: 443, Seq: 1, Ack: 1, Len: 642
Transport Layer Security
    TLSv1 Record Layer: Handshake Protocol: Client Hello (fragment)
        Content Type: Handshake (22)
        Version: TLS 1.0 (0x0301)
        Length: 20
        Handshake Protocol: Client Hello (fragment)
    TLSv1 Record Layer: Handshake Protocol: Multiple Handshake Messages
        Content Type: Handshake (22)
        Version: TLS 1.0 (0x0301)
        Length: 20
        Handshake Protocol: Client Hello (fragment)
    TLSv1 Record Layer: Handshake Protocol: Multiple Handshake Messages
        Content Type: Handshake (22)
        Version: TLS 1.0 (0x0301)
        Length: 20
        Handshake Protocol: Client Hello (fragment)
    TLSv1 Record Layer: Handshake Protocol: Multiple Handshake Messages
        Content Type: Handshake (22)
        Version: TLS 1.0 (0x0301)
        Length: 20
        Handshake Protocol: Client Hello (fragment)
    TLSv1 Record Layer: Handshake Protocol: Multiple Handshake Messages
        Content Type: Handshake (22)
        Version: TLS 1.0 (0x0301)
        Length: 20
        Handshake Protocol: Client Hello (fragment)
    TLSv1 Record Layer: Handshake Protocol: Multiple Handshake Messages
        Content Type: Handshake (22)
        Version: TLS 1.0 (0x0301)
        Length: 20
        Handshake Protocol: Client Hello (fragment)
    TLSv1 Record Layer: Handshake Protocol: Multiple Handshake Messages
        Content Type: Handshake (22)
        Version: TLS 1.0 (0x0301)
        Length: 20
        Handshake Protocol: Client Hello (fragment)
    TLSv1 Record Layer: Handshake Protocol: Multiple Handshake Messages
        Content Type: Handshake (22)
        Version: TLS 1.0 (0x0301)
        Length: 20
        Handshake Protocol: Client Hello (fragment)
    TLSv1 Record Layer: Handshake Protocol: Multiple Handshake Messages
        Content Type: Handshake (22)
        Version: TLS 1.0 (0x0301)
        Length: 20
        Handshake Protocol: Client Hello (fragment)
    TLSv1 Record Layer: Handshake Protocol: Multiple Handshake Messages
        Content Type: Handshake (22)
        Version: TLS 1.0 (0x0301)
        Length: 20
        Handshake Protocol: Client Hello (fragment)
    TLSv1 Record Layer: Handshake Protocol: Multiple Handshake Messages
        Content Type: Handshake (22)
        Version: TLS 1.0 (0x0301)
        Length: 20
        Handshake Protocol: Client Hello (fragment)
    TLSv1 Record Layer: Handshake Protocol: Multiple Handshake Messages
        Content Type: Handshake (22)
        Version: TLS 1.0 (0x0301)
        Length: 20
        Handshake Protocol: Client Hello (fragment)
    TLSv1 Record Layer: Handshake Protocol: Multiple Handshake Messages
        Content Type: Handshake (22)
        Version: TLS 1.0 (0x0301)
        Length: 20
        Handshake Protocol: Client Hello (fragment)
    TLSv1 Record Layer: Handshake Protocol: Multiple Handshake Messages
        Content Type: Handshake (22)
        Version: TLS 1.0 (0x0301)
        Length: 20
        Handshake Protocol: Client Hello (fragment)
    TLSv1 Record Layer: Handshake Protocol: Multiple Handshake Messages
        Content Type: Handshake (22)
        Version: TLS 1.0 (0x0301)
        Length: 20
        Handshake Protocol: Client Hello (fragment)
    TLSv1 Record Layer: Handshake Protocol: Multiple Handshake Messages
        Content Type: Handshake (22)
        Version: TLS 1.0 (0x0301)
        Length: 20
        Handshake Protocol: Client Hello (fragment)
    TLSv1 Record Layer: Handshake Protocol: Multiple Handshake Messages
        Content Type: Handshake (22)
        Version: TLS 1.0 (0x0301)
        Length: 20
        Handshake Protocol: Client Hello (fragment)
    TLSv1 Record Layer: Handshake Protocol: Multiple Handshake Messages
        Content Type: Handshake (22)
        Version: TLS 1.0 (0x0301)
        Length: 20
        Handshake Protocol: Client Hello (fragment)
    TLSv1 Record Layer: Handshake Protocol: Multiple Handshake Messages
        Content Type: Handshake (22)
        Version: TLS 1.0 (0x0301)
        Length: 20
        Handshake Protocol: Client Hello (fragment)
    TLSv1 Record Layer: Handshake Protocol: Multiple Handshake Messages
        Content Type: Handshake (22)
        Version: TLS 1.0 (0x0301)
        Length: 20
        Handshake Protocol: Client Hello (fragment)
    TLSv1 Record Layer: Handshake Protocol: Multiple Handshake Messages
        Content Type: Handshake (22)
        Version: TLS 1.0 (0x0301)
        Length: 20
        Handshake Protocol: Client Hello (fragment)
    TLSv1 Record Layer: Handshake Protocol: Multiple Handshake Messages
        Content Type: Handshake (22)
        Version: TLS 1.0 (0x0301)
        Length: 20
        Handshake Protocol: Client Hello (fragment)
    TLSv1 Record Layer: Handshake Protocol: Multiple Handshake Messages
        Content Type: Handshake (22)
        Version: TLS 1.0 (0x0301)
        Length: 20
        Handshake Protocol: Client Hello (fragment)
    TLSv1 Record Layer: Handshake Protocol: Multiple Handshake Messages
        Content Type: Handshake (22)
        Version: TLS 1.0 (0x0301)
        Length: 20
        Handshake Protocol: Client Hello (fragment)
    TLSv1 Record Layer: Handshake Protocol: Multiple Handshake Messages
        Content Type: Handshake (22)
        Version: TLS 1.0 (0x0301)
        Length: 20
        Handshake Protocol: Client Hello (fragment)
    TLSv1 Record Layer: Handshake Protocol: Client Hello
        Content Type: Handshake (22)
        Version: TLS 1.0 (0x0301)
        Length: 12
        Handshake Protocol: Client Hello (last fragment)
        [26 Reassembled Handshake Fragments (512 bytes): #4(20), #4(20), #4(20), #4(20), #4(20), #4(20), #4(20), #4(20), #4(20), #4(20), #4(20), #4(20), #4(20), #4(20), #4(20), #4(20), #4(20), #4(20), #4(20), #4(20), #4(20), #4(20), #4(20), #4(20),]
            [Frame: 4, payload: 0-19 (20 bytes)]
            [Frame: 4, payload: 20-39 (20 bytes)]
            [Frame: 4, payload: 40-59 (20 bytes)]
            [Frame: 4, payload: 60-79 (20 bytes)]
            [Frame: 4, payload: 80-99 (20 bytes)]
            [Frame: 4, payload: 100-119 (20 bytes)]
            [Frame: 4, payload: 120-139 (20 bytes)]
            [Frame: 4, payload: 140-159 (20 bytes)]
            [Frame: 4, payload: 160-179 (20 bytes)]
            [Frame: 4, payload: 180-199 (20 bytes)]
            [Frame: 4, payload: 200-219 (20 bytes)]
            [Frame: 4, payload: 220-239 (20 bytes)]
            [Frame: 4, payload: 240-259 (20 bytes)]
            [Frame: 4, payload: 260-279 (20 bytes)]
            [Frame: 4, payload: 280-299 (20 bytes)]
            [Frame: 4, payload: 300-319 (20 bytes)]
            [Frame: 4, payload: 320-339 (20 bytes)]
            [Frame: 4, payload: 340-359 (20 bytes)]
            [Frame: 4, payload: 360-379 (20 bytes)]
            [Frame: 4, payload: 380-399 (20 bytes)]
            [Frame: 4, payload: 400-419 (20 bytes)]
            [Frame: 4, payload: 420-439 (20 bytes)]
            [Frame: 4, payload: 440-459 (20 bytes)]
            [Frame: 4, payload: 460-479 (20 bytes)]
            [Frame: 4, payload: 480-499 (20 bytes)]
            [Frame: 4, payload: 500-511 (12 bytes)]
            [Handshake Fragment count: 26]
        Handshake Protocol: Client Hello
            Handshake Type: Client Hello (1)
            Length: 508
            Version: TLS 1.2 (0x0303)
```

## TCP segmentation
In Iran, TCP segmentation alone didn't help.

In Russia, TCP alone could bypass SNI-based censorship, but only on byte 2 (as in [01][2...]), and sometimes on byte 1 (as in [0][1...]). That split is right in the middle of the TLS version, which may confuse the TLS detection and make them give up TLS analysis.
